results/03_temporal_refinement/evaluation/temporal_refinement_evaluation_l736_v1/checkpoint_metrics.csv

bad_2mm,bad_4mm,causal,checkpoint,depth_mae_mm,depth_median_error_mm,depth_p95_error_mm,depth_rmse_mm,disparity_mae_px,disparity_rmse,edge_depth_mae,frames,method,motion_compensated_temporal_diff,nonedge_depth_mae,peak_vram_mb,refined_to_backbone_mae,refined_to_sav_mae,residual_abs_mean,residual_std,runtime_ms_per_frame,teacher_delta_mae,temporal_diff,temporal_diff_edge,temporal_diff_nonedge,temporal_diff_valid_gt,temporal_std,valid_pixel_count
nan,nan,True,,nan,nan,nan,nan,nan,nan,nan,126,raw_s2m2_l736,nan,nan,0.0,0.0,1.4577294526592133,0.0,0.0,0.0,0.7057699236869812,1.2552756021022797,1.1239488043785095,1.5149839854240417,nan,17.231460571289062,154755238
nan,nan,False,,nan,nan,nan,nan,nan,nan,nan,126,stereoanyvideo,nan,nan,0.0,1.4577294526592133,0.0,1.4577294526592133,2.702743082765549,0.0,0.0,0.9672406885623932,0.9512740640640259,0.9989471843242645,nan,16.83621597290039,154755238
nan,nan,False,results/temporal_refinement_train_unet_s2m2l736_fastcache_v2_conservative/checkpoints/best.pt,nan,nan,nan,nan,nan,nan,nan,126,tiny_unet_conservative,nan,nan,973.634765625,0.08595171647648962,1.403774448803493,0.08595171647648962,0.11744700531874384,95.65664372140807,0.6958011786937713,1.2434049863815309,1.1156770792007447,1.4959823553562164,nan,17.178571701049805,154755238
nan,nan,False,results/temporal_refinement_train_unet_s2m2l736_fastcache_v2_conservative/checkpoints/epoch_0010.pt,nan,nan,nan,nan,nan,nan,nan,126,tiny_unet_conservative:epoch_0010,nan,nan,973.634765625,0.0960744410043671,1.4212722243770721,0.0960744410043671,0.10929469983019525,94.06561862736467,0.6987845664024352,1.2462707805633544,1.1174541044235229,1.5011103806495667,nan,17.1846923828125,154755238
nan,nan,False,results/temporal_refinement_train_unet_s2m2l736_fastcache_v2_conservative/checkpoints/epoch_0020.pt,nan,nan,nan,nan,nan,nan,nan,126,tiny_unet_conservative:epoch_0020,nan,nan,973.634765625,0.11038092795818572,1.3971265686882868,0.11038092795818572,0.1355745910060784,91.99582439817725,0.6928183615207673,1.2403305191993714,1.1137864184379578,1.4906259396076202,nan,17.175674438476562,154755238
nan,nan,False,results/temporal_refinement_train_unet_s2m2l736_fastcache_v2_conservative/checkpoints/epoch_0030.pt,nan,nan,nan,nan,nan,nan,nan,126,tiny_unet_conservative:epoch_0030,nan,nan,973.634765625,0.08867358777021604,1.3981756695679255,0.08867358777021604,0.1281143446408567,92.05754708853506,0.693881217956543,1.2414252560138703,1.1146007406711578,1.4922092349529266,nan,17.17544174194336,154755238
nan,nan,False,results/temporal_refinement_train_unet_s2m2l736_fastcache_v2_conservative/checkpoints/epoch_0040.pt,nan,nan,nan,nan,nan,nan,nan,126,tiny_unet_conservative:epoch_0040,nan,nan,973.634765625,0.08595171647648962,1.403774448803493,0.08595171647648962,0.11744700531874384,90.45998215128387,0.6958011786937713,1.2434049863815309,1.1156770792007447,1.4959823553562164,nan,17.178571701049805,154755238
nan,nan,False,results/temporal_refinement_train_unet_s2m2l736_fastcache_v2_conservative/checkpoints/epoch_0050.pt,nan,nan,nan,nan,nan,nan,nan,126,tiny_unet_conservative:epoch_0050,nan,nan,973.634765625,0.09338608313174475,1.3915347475854178,0.09338608313174475,0.14077194762371836,90.76221748476937,0.6916265738010406,1.2391061868667603,1.1132083640098571,1.4880288264751433,nan,17.17120933532715,154755238
nan,nan,False,results/temporal_refinement_train_unet_s2m2l736_fastcache_v2_conservative/checkpoints/epoch_0060.pt,nan,nan,nan,nan,nan,nan,nan,126,tiny_unet_conservative:epoch_0060,nan,nan,973.634765625,0.11277034098193758,1.3787515925036535,0.11277034098193758,0.1692732000753047,90.99558923053482,0.6926768441200256,1.2397371547222138,1.1133025014400482,1.4896886332035064,nan,17.15544319152832,154755238
nan,nan,False,results/temporal_refinement_train_unet_s2m2l736_fastcache_v2_conservative/checkpoints/epoch_0070.pt,nan,nan,nan,nan,nan,nan,nan,126,tiny_unet_conservative:epoch_0070,nan,nan,973.634765625,0.10187531629252056,1.3919621393794106,0.10187531629252056,0.14257390282693364,90.03453826280459,0.6900138823986054,1.2372464864253998,1.1119031267166137,1.4851473786830902,nan,17.171161651611328,154755238
nan,nan,False,results/temporal_refinement_train_unet_s2m2l736_fastcache_v2_conservative/checkpoints/epoch_0080.pt,nan,nan,nan,nan,nan,nan,nan,126,tiny_unet_conservative:epoch_0080,nan,nan,973.634765625,0.11407915017907581,1.3814600398616186,0.11407915017907581,0.16619328870659783,90.93911550746905,0.6898315880298614,1.2368434274196625,1.1113850560188294,1.484914402961731,nan,17.155725479125977,154755238
nan,nan,False,results/temporal_refinement_train_unet_s2m2l736_fastcache_v2_conservative/checkpoints/epoch_0090.pt,nan,nan,nan,nan,nan,nan,nan,126,tiny_unet_conservative:epoch_0090,nan,nan,973.634765625,0.10369640541455102,1.3897442264216286,0.10369640541455102,0.14666601802621568,91.22051872379545,0.690203566789627,1.23729967212677,1.1118158605098725,1.4854245312213898,nan,17.1669921875,154755238
nan,nan,False,results/temporal_refinement_train_unet_s2m2l736_fastcache_v2_conservative/checkpoints/epoch_0100.pt,nan,nan,nan,nan,nan,nan,nan,126,tiny_unet_conservative:epoch_0100,nan,nan,973.634765625,0.1225934245638431,1.3793259650941878,0.1225934245638431,0.17814492824531736,90.2737703410879,0.6887048380374908,1.2353265476226807,1.1117955574989318,1.4794426319599152,nan,17.168794631958008,154755238
nan,nan,True,results/temporal_refinement_train_convgru_l736_v1_100ep_b13/checkpoints/best.pt,nan,nan,nan,nan,nan,nan,nan,126,convgru_v1_conservative,nan,nan,974.474609375,0.05502557855040308,1.435530124202607,0.05502557855040308,0.08054653768028532,67.584449380991,0.6932295055389405,1.240955428123474,1.1146468253135682,1.4907960143089294,nan,17.198165893554688,154755238
nan,nan,True,results/temporal_refinement_train_convgru_l736_v1_100ep_b13/checkpoints/latest.pt,nan,nan,nan,nan,nan,nan,nan,126,convgru_v1_conservative:latest,nan,nan,974.474609375,0.09144478368144186,1.3949883471405695,0.09144478368144186,0.14526222297360028,67.137563214933,0.6814937205314636,1.2281372137069702,1.1060559136867523,1.4696366262435914,nan,17.17133903503418,154755238
nan,nan,True,results/temporal_refinement_train_convgru_l736_v1_100ep_b13/checkpoints/epoch_0010.pt,nan,nan,nan,nan,nan,nan,nan,126,convgru_v1_conservative:epoch_0010,nan,nan,974.474609375,0.1573973929006902,1.397969550083554,0.1573973929006902,0.19479010739023722,67.72495562668949,0.685927681684494,1.2287138462066651,1.1063782091140748,1.4709270474910736,nan,17.15843391418457,154755238
nan,nan,True,results/temporal_refinement_train_convgru_l736_v1_100ep_b13/checkpoints/epoch_0020.pt,nan,nan,nan,nan,nan,nan,nan,126,convgru_v1_conservative:epoch_0020,nan,nan,974.474609375,0.11924897459527803,1.407408322606768,0.11924897459527803,0.14762156947501123,67.11204738045733,0.6856489386558533,1.231355585336685,1.1086282789707185,1.4741752066612244,nan,17.171951293945312,154755238
nan,nan,True,results/temporal_refinement_train_convgru_l736_v1_100ep_b13/checkpoints/epoch_0030.pt,nan,nan,nan,nan,nan,nan,nan,126,convgru_v1_conservative:epoch_0030,nan,nan,974.474609375,0.1222929446588433,1.4055748321707286,0.1222929446588433,0.16629356719435207,67.3002573099756,0.6774802474975586,1.2217375695705415,1.101712176322937,1.4592875611782075,nan,17.164602279663086,154755238
nan,nan,True,results/temporal_refinement_train_convgru_l736_v1_100ep_b13/checkpoints/epoch_0040.pt,nan,nan,nan,nan,nan,nan,nan,126,convgru_v1_conservative:epoch_0040,nan,nan,974.474609375,0.12253657072072938,1.389178851294139,0.12253657072072938,0.17783704879028456,67.21019478596097,0.6795759887695313,1.2244983475208282,1.1040891692638397,1.462695507287979,nan,17.150508880615234,154755238
nan,nan,True,results/temporal_refinement_train_convgru_l736_v1_100ep_b13/checkpoints/epoch_0050.pt,nan,nan,nan,nan,nan,nan,nan,126,convgru_v1_conservative:epoch_0050,nan,nan,974.474609375,0.07582865723423542,1.4139595216228849,0.07582865723423542,0.11519674868101165,66.74128593803043,0.6841232578754425,1.2309153027534485,1.1078707575798035,1.4742403056621551,nan,17.185766220092773,154755238
nan,nan,True,results/temporal_refinement_train_convgru_l736_v1_100ep_b13/checkpoints/epoch_0060.pt,nan,nan,nan,nan,nan,nan,nan,126,convgru_v1_conservative:epoch_0060,nan,nan,974.474609375,0.08814468524522251,1.4114674055387104,0.08814468524522251,0.12440130144121155,66.58543859578906,0.685273833990097,1.231637235403061,1.1085423312187195,1.4751792261600494,nan,17.179004669189453,154755238
nan,nan,True,results/temporal_refinement_train_convgru_l736_v1_100ep_b13/checkpoints/epoch_0070.pt,nan,nan,nan,nan,nan,nan,nan,126,convgru_v1_conservative:epoch_0070,nan,nan,974.474609375,0.08595265693489522,1.4061716927422419,0.08595265693489522,0.12499240915926677,66.90778047592926,0.6855472586154938,1.2326868920326233,1.1091093044281006,1.4771421852111817,nan,17.17467498779297,154755238
nan,nan,True,results/temporal_refinement_train_convgru_l736_v1_100ep_b13/checkpoints/epoch_0080.pt,nan,nan,nan,nan,nan,nan,nan,126,convgru_v1_conservative:epoch_0080,nan,nan,974.474609375,0.08349991879529423,1.4176336749205514,0.08349991879529423,0.1142032550322631,67.08317261100525,0.6861373589038849,1.2331479923725128,1.109449102640152,1.4779195039272308,nan,17.184064865112305,154755238
nan,nan,True,results/temporal_refinement_train_convgru_l736_v1_100ep_b13/checkpoints/epoch_0090.pt,nan,nan,nan,nan,nan,nan,nan,126,convgru_v1_conservative:epoch_0090,nan,nan,974.474609375,0.10295973800950581,1.3979722455380454,0.10295973800950581,0.14785271114300166,67.30220694508817,0.6812146351337433,1.2278665435314178,1.1061057295799255,1.4688215353488923,nan,17.1661434173584,154755238
nan,nan,True,results/temporal_refinement_train_convgru_l736_v1_100ep_b13/checkpoints/epoch_0100.pt,nan,nan,nan,nan,nan,nan,nan,126,convgru_v1_conservative:epoch_0100,nan,nan,974.474609375,0.09144478368144186,1.3949883471405695,0.09144478368144186,0.14526222297360028,67.27619626234093,0.6814937205314636,1.2281372137069702,1.1060559136867523,1.4696366262435914,nan,17.17133903503418,154755238
nan,nan,True,results/temporal_refinement_train_convgru_l736_v2_scheduled/checkpoints/best.pt,nan,nan,nan,nan,nan,nan,nan,126,convgru_v2_scheduled,nan,nan,974.474609375,0.12290958888710492,1.4451130647507926,0.12290958888710492,0.16639014995760387,67.05237567306511,0.7055264301300049,1.2495697245597839,1.1202078630924226,1.5054174649715424,nan,17.1757755279541,154755238
nan,nan,True,results/temporal_refinement_train_convgru_l736_v2_scheduled/checkpoints/latest.pt,nan,nan,nan,nan,nan,nan,nan,126,convgru_v2_scheduled:latest,nan,nan,974.474609375,0.25567078075948213,1.3508493554970575,0.25567078075948213,0.375004174690398,67.35020943747331,0.6467303683757782,1.1781467635631562,1.0753625466823578,1.381888358592987,nan,17.100688934326172,154755238
nan,nan,True,results/temporal_refinement_train_convgru_l736_v2_scheduled/checkpoints/epoch_0010.pt,nan,nan,nan,nan,nan,nan,nan,126,convgru_v2_scheduled:epoch_0010,nan,nan,974.474609375,0.12529522653609987,1.4280854633876257,0.12529522653609987,0.17376233258890728,68.01220265749309,0.6885954668521881,1.2328188879489899,1.1094031221866607,1.4771900033950807,nan,17.1644287109375,154755238
nan,nan,True,results/temporal_refinement_train_convgru_l736_v2_scheduled/checkpoints/epoch_0020.pt,nan,nan,nan,nan,nan,nan,nan,126,convgru_v2_scheduled:epoch_0020,nan,nan,974.474609375,0.15433921067724152,1.3989843106459057,0.15433921067724152,0.24414701558767804,67.62202069835945,0.6688350870609283,1.2046056730747223,1.0914378938674927,1.428977861881256,nan,17.144845962524414,154755238
nan,nan,True,results/temporal_refinement_train_convgru_l736_v2_scheduled/checkpoints/epoch_0030.pt,nan,nan,nan,nan,nan,nan,nan,126,convgru_v2_scheduled:epoch_0030,nan,nan,974.474609375,0.3662071591095319,1.3273823176111494,0.3662071591095319,0.4847082599760994,67.34484460367452,0.6289590566158295,1.1545004281997682,1.0598119802474975,1.3426545393466949,nan,17.07065773010254,154755238
nan,nan,True,results/temporal_refinement_train_convgru_l736_v2_scheduled/checkpoints/epoch_0040.pt,nan,nan,nan,nan,nan,nan,nan,126,convgru_v2_scheduled:epoch_0040,nan,nan,974.474609375,0.2656325647045696,1.3618709388233365,0.2656325647045696,0.4106342224847703,67.1969524525579,0.6271511585712433,1.1553712401390075,1.0598376569747925,1.3449551529884338,nan,17.095699310302734,154755238
nan,nan,True,results/temporal_refinement_train_convgru_l736_v2_scheduled/checkpoints/epoch_0050.pt,nan,nan,nan,nan,nan,nan,nan,126,convgru_v2_scheduled:epoch_0050,nan,nan,974.474609375,0.3197301156700604,1.313158769456167,0.3197301156700604,0.4386870056863815,66.94639292878232,0.6282038791179657,1.1579866061210633,1.0608150625228883,1.350615818977356,nan,17.06627082824707,154755238
nan,nan,True,results/temporal_refinement_train_convgru_l736_v2_scheduled/checkpoints/epoch_0060.pt,nan,nan,nan,nan,nan,nan,nan,126,convgru_v2_scheduled:epoch_0060,nan,nan,974.474609375,0.232027956949813,1.3731564420556266,0.232027956949813,0.376259918368998,67.15876437974946,0.6405687067508697,1.1718875513076783,1.0714004037380218,1.370890024662018,nan,17.13052749633789,154755238
nan,nan,True,results/temporal_refinement_train_convgru_l736_v2_scheduled/checkpoints/epoch_0070.pt,nan,nan,nan,nan,nan,nan,nan,126,convgru_v2_scheduled:epoch_0070,nan,nan,974.474609375,0.24738351427136906,1.3733717297750807,0.24738351427136906,0.3748241026723196,67.0976608267261,0.6441640768051148,1.17198930311203,1.072862781047821,1.3687491071224214,nan,17.116161346435547,154755238
nan,nan,True,results/temporal_refinement_train_convgru_l736_v2_scheduled/checkpoints/epoch_0080.pt,nan,nan,nan,nan,nan,nan,nan,126,convgru_v2_scheduled:epoch_0080,nan,nan,974.474609375,0.29489482945156476,1.3990665910735962,0.29489482945156476,0.4405508463581403,66.75407825414801,0.6598126697540283,1.1784878141880035,1.0811609654426575,1.371502699613571,nan,17.13373565673828,154755238
nan,nan,True,results/temporal_refinement_train_convgru_l736_v2_scheduled/checkpoints/epoch_0090.pt,nan,nan,nan,nan,nan,nan,nan,126,convgru_v2_scheduled:epoch_0090,nan,nan,974.474609375,0.2941841251320309,1.4245243933465745,0.2941841251320309,0.44564572615282877,67.03879898377059,0.6625325541496276,1.1782232358455658,1.083398564338684,1.3663035600185394,nan,17.170024871826172,154755238
nan,nan,True,results/temporal_refinement_train_convgru_l736_v2_scheduled/checkpoints/epoch_0100.pt,nan,nan,nan,nan,nan,nan,nan,126,convgru_v2_scheduled:epoch_0100,nan,nan,974.474609375,0.25567078075948213,1.3508493554970575,0.25567078075948213,0.375004174690398,67.34064772229878,0.6467303683757782,1.1781467635631562,1.0753625466823578,1.381888358592987,nan,17.100688934326172,154755238

results/03_temporal_refinement/evaluation/temporal_refinement_evaluation_l736_v1/report.md

## Summary

- `raw_s2m2_l736`: temporal_diff=1.2553, teacher_delta=0.7058, to_backbone=0.0000, to_SAV=1.4577, runtime=0.00 ms
- `stereoanyvideo`: temporal_diff=0.9672, teacher_delta=0.0000, to_backbone=1.4577, to_SAV=0.0000, runtime=0.00 ms
- `ema_alpha_0.3`: temporal_diff=0.8788, teacher_delta=0.6614, to_backbone=1.9293, to_SAV=2.6138, runtime=0.00 ms
- `prev_blend_alpha_0.3`: temporal_diff=1.1177, teacher_delta=0.7206, to_backbone=0.8231, to_SAV=1.7085, runtime=0.00 ms
- `ema_alpha_0.5`: temporal_diff=0.9991, teacher_delta=0.5882, to_backbone=0.9382, to_SAV=1.8267, runtime=0.00 ms
- `prev_blend_alpha_0.5`: temporal_diff=1.0905, teacher_delta=0.6099, to_backbone=0.5880, to_SAV=1.5820, runtime=0.00 ms
- `ema_alpha_0.7`: temporal_diff=1.0970, teacher_delta=0.5852, to_backbone=0.4409, to_SAV=1.5329, runtime=0.00 ms
- `prev_blend_alpha_0.7`: temporal_diff=1.1213, teacher_delta=0.5863, to_backbone=0.3528, to_SAV=1.4898, runtime=0.00 ms
- `ema_alpha_0.9`: temporal_diff=1.1961, teacher_delta=0.6453, to_backbone=0.1245, to_SAV=1.4502, runtime=0.00 ms
- `prev_blend_alpha_0.9`: temporal_diff=1.1984, teacher_delta=0.6449, to_backbone=0.1176, to_SAV=1.4493, runtime=0.00 ms
- `median3_noncausal`: temporal_diff=1.0257, teacher_delta=0.5303, to_backbone=0.1562, to_SAV=1.4244, runtime=0.00 ms
- `median3_causal`: temporal_diff=1.0195, teacher_delta=0.8176, to_backbone=1.0227, to_SAV=1.9009, runtime=0.00 ms
- `median5_noncausal`: temporal_diff=0.9447, teacher_delta=0.4916, to_backbone=0.2397, to_SAV=1.4117, runtime=0.00 ms
- `median5_causal`: temporal_diff=0.9316, teacher_delta=0.9191, to_backbone=1.8722, to_SAV=2.5900, runtime=0.00 ms
- `tiny_unet_conservative`: temporal_diff=1.2434, teacher_delta=0.6958, to_backbone=0.0860, to_SAV=1.4038, runtime=95.66 ms
- `tiny_unet_conservative:epoch_0010`: temporal_diff=1.2463, teacher_delta=0.6988, to_backbone=0.0961, to_SAV=1.4213, runtime=94.07 ms
- `tiny_unet_conservative:epoch_0020`: temporal_diff=1.2403, teacher_delta=0.6928, to_backbone=0.1104, to_SAV=1.3971, runtime=92.00 ms
- `tiny_unet_conservative:epoch_0030`: temporal_diff=1.2414, teacher_delta=0.6939, to_backbone=0.0887, to_SAV=1.3982, runtime=92.06 ms
- `tiny_unet_conservative:epoch_0040`: temporal_diff=1.2434, teacher_delta=0.6958, to_backbone=0.0860, to_SAV=1.4038, runtime=90.46 ms
- `tiny_unet_conservative:epoch_0050`: temporal_diff=1.2391, teacher_delta=0.6916, to_backbone=0.0934, to_SAV=1.3915, runtime=90.76 ms
- `tiny_unet_conservative:epoch_0060`: temporal_diff=1.2397, teacher_delta=0.6927, to_backbone=0.1128, to_SAV=1.3788, runtime=91.00 ms
- `tiny_unet_conservative:epoch_0070`: temporal_diff=1.2372, teacher_delta=0.6900, to_backbone=0.1019, to_SAV=1.3920, runtime=90.03 ms
- `tiny_unet_conservative:epoch_0080`: temporal_diff=1.2368, teacher_delta=0.6898, to_backbone=0.1141, to_SAV=1.3815, runtime=90.94 ms
- `tiny_unet_conservative:epoch_0090`: temporal_diff=1.2373, teacher_delta=0.6902, to_backbone=0.1037, to_SAV=1.3897, runtime=91.22 ms
- `tiny_unet_conservative:epoch_0100`: temporal_diff=1.2353, teacher_delta=0.6887, to_backbone=0.1226, to_SAV=1.3793, runtime=90.27 ms
- `convgru_v1_conservative`: temporal_diff=1.2410, teacher_delta=0.6932, to_backbone=0.0550, to_SAV=1.4355, runtime=67.58 ms
- `convgru_v1_conservative:latest`: temporal_diff=1.2281, teacher_delta=0.6815, to_backbone=0.0914, to_SAV=1.3950, runtime=67.14 ms
- `convgru_v1_conservative:epoch_0010`: temporal_diff=1.2287, teacher_delta=0.6859, to_backbone=0.1574, to_SAV=1.3980, runtime=67.72 ms
- `convgru_v1_conservative:epoch_0020`: temporal_diff=1.2314, teacher_delta=0.6856, to_backbone=0.1192, to_SAV=1.4074, runtime=67.11 ms
- `convgru_v1_conservative:epoch_0030`: temporal_diff=1.2217, teacher_delta=0.6775, to_backbone=0.1223, to_SAV=1.4056, runtime=67.30 ms
- `convgru_v1_conservative:epoch_0040`: temporal_diff=1.2245, teacher_delta=0.6796, to_backbone=0.1225, to_SAV=1.3892, runtime=67.21 ms
- `convgru_v1_conservative:epoch_0050`: temporal_diff=1.2309, teacher_delta=0.6841, to_backbone=0.0758, to_SAV=1.4140, runtime=66.74 ms
- `convgru_v1_conservative:epoch_0060`: temporal_diff=1.2316, teacher_delta=0.6853, to_backbone=0.0881, to_SAV=1.4115, runtime=66.59 ms
- `convgru_v1_conservative:epoch_0070`: temporal_diff=1.2327, teacher_delta=0.6855, to_backbone=0.0860, to_SAV=1.4062, runtime=66.91 ms
- `convgru_v1_conservative:epoch_0080`: temporal_diff=1.2331, teacher_delta=0.6861, to_backbone=0.0835, to_SAV=1.4176, runtime=67.08 ms
- `convgru_v1_conservative:epoch_0090`: temporal_diff=1.2279, teacher_delta=0.6812, to_backbone=0.1030, to_SAV=1.3980, runtime=67.30 ms
- `convgru_v1_conservative:epoch_0100`: temporal_diff=1.2281, teacher_delta=0.6815, to_backbone=0.0914, to_SAV=1.3950, runtime=67.28 ms
- `convgru_v2_scheduled`: temporal_diff=1.2496, teacher_delta=0.7055, to_backbone=0.1229, to_SAV=1.4451, runtime=67.05 ms
- `convgru_v2_scheduled:latest`: temporal_diff=1.1781, teacher_delta=0.6467, to_backbone=0.2557, to_SAV=1.3508, runtime=67.35 ms
- `convgru_v2_scheduled:epoch_0010`: temporal_diff=1.2328, teacher_delta=0.6886, to_backbone=0.1253, to_SAV=1.4281, runtime=68.01 ms
- `convgru_v2_scheduled:epoch_0020`: temporal_diff=1.2046, teacher_delta=0.6688, to_backbone=0.1543, to_SAV=1.3990, runtime=67.62 ms
- `convgru_v2_scheduled:epoch_0030`: temporal_diff=1.1545, teacher_delta=0.6290, to_backbone=0.3662, to_SAV=1.3274, runtime=67.34 ms
- `convgru_v2_scheduled:epoch_0040`: temporal_diff=1.1554, teacher_delta=0.6272, to_backbone=0.2656, to_SAV=1.3619, runtime=67.20 ms
- `convgru_v2_scheduled:epoch_0050`: temporal_diff=1.1580, teacher_delta=0.6282, to_backbone=0.3197, to_SAV=1.3132, runtime=66.95 ms
- `convgru_v2_scheduled:epoch_0060`: temporal_diff=1.1719, teacher_delta=0.6406, to_backbone=0.2320, to_SAV=1.3732, runtime=67.16 ms
- `convgru_v2_scheduled:epoch_0070`: temporal_diff=1.1720, teacher_delta=0.6442, to_backbone=0.2474, to_SAV=1.3734, runtime=67.10 ms
- `convgru_v2_scheduled:epoch_0080`: temporal_diff=1.1785, teacher_delta=0.6598, to_backbone=0.2949, to_SAV=1.3991, runtime=66.75 ms
- `convgru_v2_scheduled:epoch_0090`: temporal_diff=1.1782, teacher_delta=0.6625, to_backbone=0.2942, to_SAV=1.4245, runtime=67.04 ms
- `convgru_v2_scheduled:epoch_0100`: temporal_diff=1.1781, teacher_delta=0.6467, to_backbone=0.2557, to_SAV=1.3508, runtime=67.34 ms